{
  "metadata": {
    "model": "SuperGoodReasonModel",
    "version": "0.1-en-integrated",
    "source_language": "fi",
    "language": "en",
    "author": "Eki Laitila",
    "created_for": "Axiomatic Systems Science – Geometry of Thinking",
    "purpose": "A universal α–Ω configurator for GoodReason-based systemic inquiry, AI-assisted synthesis, axiomatic reasoning, and methodological demonstration.",
    "methodological_backbone": {
      "χ1": "System of Interest / source material",
      "χ2": "Metasystemic view",
      "χ3": "Guiding prompt or control model",
      "χ4": "Metadiscipline",
      "χ5": "Cognitive integration",
      "χ6": "Axiomatic configuration",
      "χ7": "Collective intelligence"
    },
    "core_assumptions": [
      "The model is universal and can serve as a template for specialized models.",
      "Each sector has seven levels; level 7 remains deliberately open because philosophy cannot be fully standardized.",
      "The α-sector includes two modes: researcher identity and object/system identity.",
      "The Ω-sector mirrors α through researcher feedback and object/system feedback.",
      "The ΔΨ-sector is treated as objective change pressure, including failure, collapse, devolution, and survival thresholds.",
      "The β, φ, and τ sectors include failure conditions so that organizational, design, and implementation models remain reality-oriented.",
      "The χ-axis functions as the methodological backbone from source material to collective intelligence.",
      "The model is intended to be AI-readable and usable as a prompt/configuration structure for synthesis and testing."
    ]
  },
  "sectors": {
    "α": [
      {
        "symbol": "α1",
        "class": "α",
        "title": "Actor: Subject–Object Relation (Motive)",
        "mode": "researcher_identity / object_identity",
        "identity_note": "At this level, the actor becomes aware of a System of Interest. The motive may arise from the researcher’s own identity, from the apparent purpose of the object, or from the first tension between the two.",
        "α": "Purpose begins as orientation: an actor recognizes the SOI and directs attention toward it. The primary question is why this inquiry, action, or concern should begin.",
        "π": "The theoretical basis is minimal: naming and basic statements are sufficient. The explanation does not yet require a developed theory.",
        "χ": "The SOI becomes visible in an everyday way: what matters in the situation is recognized immediately.",
        "Δψ": "Motive is triggered by observation: observation → wonder → question. Pressure is not yet experienced as crisis; it appears as an impulse to act or inquire.",
        "β": "The actor setting creates a minimal structure: actor–object–task. Roles appear clear and stable.",
        "φ": "The solution is a basic step that moves the inquiry or action forward without optimization.",
        "τ": "The actor connects with the object through practical engagement. Interaction is direct and context-bound.",
        "Ω": "Feedback is immediate: the first response either strengthens the motive or weakens it.",
        "hard_soft_note": "In hard systems, purpose may appear as task orientation. In soft systems, purpose may already include interpretation, stakeholder meaning, or researcher involvement.",
        "second_order_note": "The researcher may stand outside the SOI as an observer, or begin to recognize personal participation in the SOI.",
        "info": "https://en.wikipedia.org/wiki/Motivation"
      },
      {
        "symbol": "α2",
        "class": "α",
        "title": "Object: Environment and Pragmatic Meaning",
        "mode": "object_identity emerges",
        "identity_note": "The SOI begins to show its own identity in relation to an environment. The researcher’s purpose and the object’s apparent purpose may begin to diverge.",
        "α": "Purpose shifts from doing to understanding: the actor seeks to understand the SOI in relation to its environment.",
        "π": "Expression becomes explanatory: naming is not enough; the meaning of the object in its situation must be opened.",
        "χ": "The environment becomes active: the receiver’s interpretation, situation, and context influence whether the object is understood correctly.",
        "Δψ": "Uncertainty arises: has the intended meaning been understood, or is there a mismatch between researcher interpretation and object identity?",
        "β": "The structure expands into interaction: actor–object–receiver form a basic triad.",
        "φ": "The solution is clarification: an example, analogy, or reformulation makes the purpose more precise.",
        "τ": "Action becomes dialogical: meaning is tested through responses and reactions.",
        "Ω": "Feedback is interpretation: the system reveals whether the intended meaning was understood or distorted.",
        "hard_soft_note": "In hard systems, purpose may be derived from design or function. In soft systems, purpose is negotiated among actors, stakeholders, and interpretations.",
        "second_order_note": "Second-order awareness begins when the observer recognizes that the act of description affects the meaning of the SOI.",
        "info": "https://en.wikipedia.org/wiki/Pragmatics"
      },
      {
        "symbol": "α3",
        "class": "α",
        "title": "Context: Initial Situation and Tension",
        "mode": "tension between researcher and object",
        "identity_note": "Purpose becomes contextual. The researcher’s question and the SOI’s own conditions form a tension that starts to guide the inquiry.",
        "α": "Purpose turns outward: the actor recognizes that the current situation is insufficient and begins to search for a more complete understanding.",
        "π": "Expression becomes selective: not everything is stated; essential assumptions and starting conditions are brought forward.",
        "χ": "Context expands: the SOI is seen as part of a wider whole where boundaries, contradictions, and constraints become visible.",
        "Δψ": "Tension emerges between the current state and a possible new state. This tension moves thought forward.",
        "β": "The structure contains oppositions: the existing order no longer covers all relevant phenomena.",
        "φ": "The solution is not yet a final action, but the recognition of direction: where change or inquiry should move.",
        "τ": "Action is exploratory: different directions are tested without commitment to a final solution.",
        "Ω": "Feedback is directional: experience confirms or weakens the sense that the current model is insufficient.",
        "hard_soft_note": "Hard systems often locate tension in performance gaps. Soft systems locate tension in meanings, purposes, and stakeholder interpretations.",
        "second_order_note": "The researcher may now become part of the context being studied, especially when meanings, values, or social interpretations are involved.",
        "info": "https://en.wikipedia.org/wiki/Context"
      },
      {
        "symbol": "α4",
        "class": "α",
        "title": "Knowledge Ground: Valid Knowing and Epistemic Identity",
        "mode": "epistemic stabilization",
        "identity_note": "The inquiry asks what counts as valid knowledge. The identity of the researcher as knower and the identity of the SOI as describable object are both clarified.",
        "α": "Purpose is to stabilize what is accepted as valid knowledge in this whole.",
        "π": "Expression is based on accepted concepts and principles; meaning is no longer merely exploratory.",
        "χ": "The SOI appears as a coherent knowledge structure: parts, relations, and interpretations align.",
        "Δψ": "Tension is reduced as the epistemic basis becomes clearer.",
        "β": "The structure becomes normative: valid knowledge is distinguished from opinion, noise, or error.",
        "φ": "The solution is the acceptance of a knowledge basis: this is how the matter is known, described, and presented.",
        "τ": "Action relies on shared understanding: decisions and explanations become repeatable.",
        "Ω": "Feedback is trust: knowledge becomes stable enough for broader use.",
        "hard_soft_note": "Hard systems emphasize measurement, verification, and repeatability. Soft systems require legitimacy, shared interpretation, and reflective validation.",
        "second_order_note": "Second-order science becomes explicit when the researcher’s epistemic position is also examined as part of the knowledge process.",
        "info": "https://en.wikipedia.org/wiki/Epistemology"
      },
      {
        "symbol": "α5",
        "class": "α",
        "title": "Challenge: Anticipation and Vision",
        "mode": "future-oriented purpose",
        "identity_note": "Purpose becomes anticipatory. The researcher and the SOI are now related through possible futures, not only through present description.",
        "α": "Purpose turns toward the future: the actor recognizes possibilities that the current state does not yet contain.",
        "π": "Expression becomes opening and hypothetical: visions, hypotheses, and alternatives complement established descriptions.",
        "χ": "The SOI is seen as potential: the environment offers possibilities that can be combined in new ways.",
        "Δψ": "Tension arises between what is and what could be.",
        "β": "The structure is open: room is left for experiments, new connections, and emerging forms.",
        "φ": "The solution is anticipation: possible directions are sketched without premature closure.",
        "τ": "Action is probing: experiments, combinations, and observations reveal what may begin to form.",
        "Ω": "Feedback is resonance: the vision is tested by whether it is recognized as meaningful, credible, or inspiring.",